{
  "commit": "e50d983c22a1d3326da80a02dc043ca8eb0652ce",
  "status": "not ok",
  "review_comments": [
    "tests/unit/create-server.test.ts:64-96 hard-codes `/Users/tom/personal/revurb/...` and rewrites `tests/fixtures/test-config.ts` in-place via `Bun.write`. The suite will immediately fail on any other machine (the absolute path usually doesn’t exist) and, even locally, it permanently mutates a tracked fixture so running the unit tests dirties the repo. Please resolve by using a path derived from `import.meta.dir`/`process.cwd()` and write to a temporary file or reset the fixture after the test.",
    "Factory.initialize() short-circuits after the first call (src/servers/reverb/factory.ts:241-345) and createServer()/shutdown never reset that singleton state (src/servers/reverb/factory.ts:1364-1444). As soon as one server is started, any later `createServer` invocation—even if it receives a different config—continues using the very first ApplicationManager/channel manager, so new app credentials or server settings are ignored. The new programmatic API therefore can’t reliably spin up multiple isolated servers per process, which undercuts the embedding/testing objective. Consider resetting Factory state on shutdown or rejecting subsequent calls when configs differ, and document the behavior.",
    "README.md still only documents CLI usage (README.md:50-120) even though the spec explicitly requires documenting the new programmatic `createServer` API (`specs/2025-11-13-2057-implement-server-factory.md:96`). Without a README/docs section showing how to import and shut down the helper, consumers can’t discover the new capability."
  ],
  "additional_comments": "Recorded the findings in specs/review.md and pushed as e50d983. Next steps: 1) fix the unit test to use relative/temporary files, 2) make `createServer` safe (or explicitly single-use) by resetting Factory state between runs, and 3) add README/docs coverage for the exported helper."
}
